Type,Message,,,
normal text,somewhere out there beneath the pale moon light someone think in of u some where out there where dreams come true... goodnite &amp; sweet dreams,,,
normal text,Well there's a pattern emerging of my friends telling me to drive up and come smoke with them and then telling me that I'm a weed fiend/make them smoke too much/impede their doing other things so you see how I'm hesitant,,,
normal text,", ow u dey.i paid 60,400thousad.i told  u would call . ",,,
normal text,IM FINE BABES AINT BEEN UP 2 MUCH THO! SAW SCARY MOVIE YEST ITS QUITE FUNNY! WANT 2MRW AFTERNOON? AT TOWN OR MALL OR SUMTHIN?xx,,,
normal text,I'm reaching home in 5 min.,,,
normal text,"Forgot you were working today! Wanna chat, but things are ok so drop me a text when you're free / bored etc and i'll ring. Hope all is well, nose essay and all xx",,,
normal text,Ha... Then we must walk to everywhere... Cannot take tram. My cousin said can walk to vic market from our hotel ,,,
it may be a spam message,"Wan2 win a Meet+Greet with Westlife 4 U or a m8? They are currently on what tour? 1)Unbreakable, 2)Untamed, 3)Unkempt. Text 1,2 or 3 to 83049. Cost 50p +std text",,,
it may be a spam message,Please call our customer service representative on FREEPHONE 0808 145 4742 between 9am-11pm as you have WON a guaranteed ï¿½ï¿½ï¿½ï¿½ï¿½ï¿½ï¿½ï¿½ï¿½ï,,,
normal text,Discussed with your mother ah?,,,
normal text,Ok.,,,
normal text,"Sorry, I can't text &amp; drive coherently, see you in twenty",,,
it may be a spam message,You will be receiving this week's Triple Echo ringtone shortly. Enjoy it!,,,
normal text,In which place i can get rooms cheap:-),,,
normal text,Eek that's a lot of time especially since American Pie is like 8 minutes long. I can't stop singing it.,,,
normal text,"\GRAN ONLYFOUND OUT AFEW DAYS AGO.CUSOON HONI\""""",,,
it may be a spam message,U've been selected to stay in 1 of 250 top British hotels - FOR NOTHING! Holiday valued at ï¿½ï¿½ï¿½ï¿½ï¿½ï¿½ï¿½ï¿½ï¿½ï¿½ï¿½ï¿½ï¿½ï¿½ï¿½ï¿½ï¿½ï¿½350! Dial 0871,,,
normal text,University of southern california.,,,
normal text,We have to pick rayan macleran there.,,,
normal text,U gd lor go shopping i got stuff to do. U wan 2 watch infernal affairs a not? Come lar...,,,
normal text,Well. Balls. Time to make calls,,,
normal text,Wat time ï¿½ï¿½ï¿½ï¿½ï,,,
normal text, &lt;#&gt;  in mca. But not conform.,,,
normal text,Oh ok.. Wat's ur email?,,,
normal text,"Yes, princess. Are you going to make me moan?",,,
normal text,Lol its ok I didn't remember til last nite,,,
normal text,[ï¿½ï¿½ï¿½ï¿½ï¿½ï¿½ï¿½ï¿½ï¿½ï¿½ï¿½ï¿½ï¿½,,,
normal text,"Cool, I'll text you in a few",,,
normal text,"Sorry vikky, i'm Watching olave mandara movie kano in trishul theatre wit my frnds..",,,
normal text,I'm very happy for you babe ! Woo hoo party on dude!,,,
normal text,I am taking you for italian food. How about a pretty dress with no panties? :),,,
normal text,Wot u up 2? Thout u were gonna call me!! Txt bak luv K,,,
it may be a spam message,YOU ARE CHOSEN TO RECEIVE A ï¿½ï¿½ï¿½ï¿½ï¿½ï¿½ï¿½ï¿½ï¿½ï¿½ï¿½ï¿½ï¿½ï¿½ï¿½ï¿½ï¿½ï¿½350 AWARD! Pls call claim number 09066364311 to collect your award which you ,,,
normal text,How are you holding up?,,,
normal text,Dont flatter yourself... Tell that man of mine two pints of carlin in ten minutes please.... ,,,
normal text,Hope you are not scared!,,,
normal text,I cant pick the phone right now. Pls send a message,,,
normal text,I'm at home n ready...,,,
it may be a spam message,Please call our customer service representative on FREEPHONE 0808 145 4742 between 9am-11pm as you have WON a guaranteed ï¿½ï¿½ï¿½ï¿½ï¿½ï¿½ï¿½ï¿½ï¿½ï,,,
normal text,What time do u get out?,,,
normal text,I am literally in bed and have been up for like  &lt;#&gt;  hours,,,
normal text,"Yes, my reg is  Ciao!",,,
normal text,If You mean the website. Yes.,,,
it may be a spam message,Win a ï¿½ï¿½ï¿½ï¿½ï¿½ï¿½ï¿½ï¿½ï¿½ï¿½ï¿½ï¿½ï¿½ï¿,,,
it may be a spam message,"Thanks for your ringtone order, reference number X49.Your mobile will be charged 4.50. Should your tone not arrive please call customer services 09065989182",,,
normal text,Lol or I could just starve and lose a pound by the end of the day.,,,
normal text,Yeah that's the impression I got,,,
normal text,Ok ok take care. I can understand.,,,
normal text,"Motivate Behind every darkness, there is a shining light waiting for you to find it... Behind every best friend, there is always trust and love... BSLVYL",,,
normal text,"Ya ok, then had dinner?",,,
normal text,I was slept that time.you there?,,,
normal text,dont make ne plans for nxt wknd coz she wants us to come down then ok,,,
normal text,When is school starting. Where will you stay. What's the weather like. And the food. Do you have a social support system like friends in the school. All these things are important.,,,
normal text,"Ha ha nan yalrigu heltini..Iyo kothi chikku, u shared many things wit me..so far i didn't told any body and even uttered a word abt u.. If ur trusting me so much how can i tell these to others.. Plz nxt time dont use those words to me..ok, chikku:-);-)B-)",,,
normal text,Noice. Text me when you're here,,,
normal text,Hi di is yijue we're meeting at 7 pm at esaplanade tonight.,,,
it may be a spam message,Moby Pub Quiz.Win a ï¿½ï¿½ï¿½ï¿½ï¿½ï¿½ï¿½ï¿½ï¿½ï¿½ï¿½ï¿½ï¿½ï¿½ï¿½ï¿½ï¿½ï¿½100 High Street prize if u know who the new Duchess of Cornwall will be? Txt her f,,,
it may be a spam message,"This weeks SavaMob member offers are now accessible. Just call 08709501522 for details! SavaMob, POBOX 139, LA3 2WU. Only ï¿½ï¿½ï¿½ï¿½ï¿½ï¿½ï¿½ï¿½ï¿½ï¿½ï¿½ï¿½ï",,,
normal text,"Aight I've been set free, think you could text me blake's address? It occurs to me I'm not quite as sure what I'm doing as I thought I was",,,
normal text,Hi dear we saw dear. We both are happy. Where you my battery is low,,,
normal text,How are you. Its been ages. How's abj,,,
normal text,Prof: you have passed in all the papers in this sem congrats . . . . Student: Enna kalaachutaarama..!! Prof:???? Gud mrng!,,,
normal text,Dont kick coco when he's down,,,
normal text,Fyi I'm gonna call you sporadically starting at like  &lt;#&gt;  bc we are not not doin this shit,,,
it may be a spam message,"You are being contacted by our Dating Service by someone you know! To find out who it is, call from your mobile or landline 09064017305 PoBox75LDNS7 ",,,
it may be a spam message,TBS/PERSOLVO. been chasing us since Sept forï¿½ï¿½ï¿½ï¿½ï¿½ï¿½ï¿½ï¿½ï¿½ï¿½ï¿½ï¿½ï¿½ï¿½ï¿½ï¿½ï¿½ï¿½38 definitely not paying now thanks to your,,,
normal text,Hope youï¿½ï¿½ï¿½ï¿½ï¿½ï¿½ï¿½ï¿½ï¿½ï¿½ï¿½ï¿½ï¿½ï¿½ï¿½ï¿½ï¿½ï¿½re not having ,,,
normal text,Ok i wont call or disturb any one. I know all are avoiding me. I am a burden for all,,,
normal text,I've reached home n i bathe liao... U can call me now...,,,
it may be a spam message,Loans for any purpose even if you have Bad Credit! Tenants Welcome. Call NoWorriesLoans.com on 08717111821,,,
normal text,Was the actual exam harder than NBME,,,
normal text,A lot of this sickness thing going round. Take it easy. Hope u feel better soon. Lol,,,
normal text,"God picked up a flower and dippeditinaDEW, lovingly touched itwhichturnedinto u, and the he gifted tomeandsaid,THIS FRIEND IS 4U",,,
it may be a spam message,87077: Kick off a new season with 2wks FREE goals & news to ur mobile! Txt ur club name to 87077 eg VILLA to 87077,,,
normal text,Hey sathya till now we dint meet not even a single time then how can i saw the situation sathya.,,,
normal text,Gam gone after outstanding innings.,,,
normal text,O i played smash bros  &lt;#&gt;  religiously.,,,
normal text,"Sir, good morning. Hope you had a good weekend. I called to let you know that i was able to raise  &lt;#&gt;  from my dad. He however said he would make the rest available by mid feb. This amount is still quite short and i was hoping you would help. Do have a good day. Abiola",,,
normal text,Hurry home. Soup is DONE!,,,
normal text,No no. I will check all rooms befor activities,,,
normal text,"Good afternoon, my love. It was good to see your words on YM and get your tm. Very smart move, my slave ... *smiles* ... I drink my coffee and await you.",,,
normal text,Quite ok but a bit ex... U better go eat smth now else i'll feel guilty...,,,
it may be a spam message,"Orange brings you ringtones from all time Chart Heroes, with a free hit each week! Go to Ringtones & Pics on wap. To stop receiving these tips reply STOP.",,,
normal text,Lemme know when you're here,,,
it may be a spam message,PRIVATE! Your 2003 Account Statement for 07973788240 shows 800 un-redeemed S. I. M. points. Call 08715203649 Identifier Code: 40533 Expires 31/10/04,,,
normal text,He needs to stop going to bed and make with the fucking dealing,,,
normal text,"How are you, my Love ? Are you with your brother ? Time to talk english with him ? *grins* Say : Hey Muhommad, Penny says hello from across the sea",,,
it may be a spam message,We tried to call you re your reply to our sms for a video mobile 750 mins UNLIMITED TEXT + free camcorder Reply of call 08000930705 Now,,,
normal text,"Hey doc pls I want to get nice t shirt for my hubby nice fiting ones my budget is  &lt;#&gt; k help pls I will load d card abi hw,keep me posted luv. 2 mj",,,
normal text,I remain unconvinced that this isn't an elaborate test of my willpower,,,
normal text,"\Life is nothing wen v get everything\"". But \""life is everything wen v miss something \"". Real value of people wil be realized only in their absence.... gud mrng""",,,
normal text,how are you? I miss you!,,,
normal text,I ain't answerin no phone at what is actually a pretty reasonable hour but I'm sleepy,,,
normal text,"Hey , is * rite u put ï¿½ï¿½ï¿½ï¿½ï¿½ï¿½ï¿½ï¿½ï¿½",,,
normal text,i am going to bed now prin,,,
normal text,I think just yourself ï¿½ï¿½ï¿½ï¿½ï¿½ï¿½ï¿½ï¿½ï¿,,,
normal text,If u dun drive then how i go 2 sch.,,,
normal text,I not at home now lei...,,,
it may be a spam message,GSOH? Good with it may be a spam message the ladies?U could b a male gigolo? 2 join the uk's fastest growing mens club reply ONCALL. mjzgroup. 08714342399.2stop reply STOP. msg@ï¿½ï¿½ï¿½ï,,,
normal text,Ok then i will come to ur home after half an hour,,,
it may be a spam message,U have a secret admirer who is looking 2 make contact with U-find out who they R*reveal who thinks UR so special-call on 09058094599,,,
normal text,Do u hav any frnd by name ashwini in ur college?,,,
normal text,Jus finish my lunch on my way home lor... I tot u dun wan 2 stay in sch today...,,,
normal text,K then 2marrow are you coming to class.,,,
it may be a spam message,"HOT LIVE FANTASIES call now 08707500020 Just 20p per min NTT Ltd, PO Box 1327 Croydon CR9 5WB 0870 is a national rate call",,,
normal text,Pls send me your address sir.,,,
normal text,I want to lick your pussy now...,,,
normal text,"Yo, you gonna still be in stock tomorrow/today? I'm trying to get a dubsack",,,
it may be a spam message,URGENT! Your Mobile number has been awarded a <UKP>2000 prize GUARANTEED. Call 09061790125 from landline. Claim 3030. Valid 12hrs only 150ppm,,,
normal text,"I'll see, but prolly yeah",,,
normal text,Thought we could go out for dinner. I'll treat you! Seem ok?,,,
normal text,Where are you ? What do you do ? How can you stand to be away from me ? Doesn't your heart ache without me ? Don't you wonder of me ? Don't you crave me ?,,,
normal text,Sorry. You never hear unless you book it. One was kinda a joke--thet were really looking for skinny white girls. The other was one line--you can only do so much on camera with that. Something like that they're casting on the look.,,,
normal text,What you doing?how are you?,,,
normal text,"Sure thing big man. i have hockey elections at 6, shouldnï¿½ï¿½ï¿½ï¿½ï¿½ï¿½ï¿½ï¿½ï¿½ï¿½ï¿½ï¿½ï",,,
normal text,Watch lor. I saw a few swatch one i thk quite ok. Ard 116 but i need 2nd opinion leh...,,,
normal text,Hiya do u like the hlday pics looked horrible in them so took mo out! Hows the camp Amrca thing? Speak soon Serena:),,,
normal text,"Babe! How goes that day ? What are you up to ? I miss you already, my Love ... * loving kiss* ... I hope everything goes well.",,,
normal text,Yunny... I'm goin to be late,,,
normal text,Doc prescribed me morphine cause the other pain meds aren't enough. Waiting for my mom to bring it. That med should kick in fast so I'm gonna try to be on later,,,
normal text,"Cool, want me to go to kappa or should I meet you outside mu",,,
normal text,"Hey sexy buns ! Have I told you ? I adore you, loverboy. I hope you remember to thank your sister in law for those meatballs *grins* ... i love you, babe",,,
normal text,May b approve panalam...but it should have more posts..,,,
it may be a spam message,"SPJanuary Male Sale! Hot Gay chat now cheaper, call 08709222922. National rate from 1.5p/min cheap to 7.8p/min peak! To stop texts call 08712460324 (10p/min)",,,
normal text,"Sorry, I'll call later",,,
normal text,I dont thnk its a wrong calling between us,,,
normal text,Me i'm not workin. Once i get job...,,,
normal text,And by when you're done I mean now,,,
normal text,\Its Ur luck to Love someone. Its Ur fortune to Love the one who Loves U. But," its a miracle to Love a person who can't Love anyone except U...\"" Gud nyt...""",,
normal text,Hi baby ive just got back from work and i was wanting to see u allday! I hope i didnt piss u off on the phone today. If u are up give me a call xxx,,,
it may be a spam message,FreeMsg Today's the day if you are ready! I'm horny & live in your town. I love sex fun & games! Netcollex Ltd 08700621170150p per msg reply Stop to end,,,
normal text,Is it your yahoo boys that bring in the perf? Or legal.,,,
normal text,No need to say anything to me. I know i am an outsider,,,
normal text,have you ever had one foot before?,,,
normal text,Just got to  &lt;#&gt;,,,
normal text,"Good! No, donï¿½ï¿½ï¿½ï¿½ï¿½ï¿½ï¿½ï¿½ï¿½ï¿½ï¿½ï¿½ï¿½ï¿½ï¿½ï¿½ï¿½ï¿½ï¿½ï¿½ï¿½ï¿½ï¿½ï¿½ï¿½ï¿½ï¿½t need any receip",,,
normal text,"Ever green quote ever told by Jerry in cartoon \A Person Who Irritates u Always Is the one Who Loves u Vry Much But Fails to Express It...!..!! :-) :-) gud nyt""",,,
normal text,Leave it wif me lar... ï¿½ï¿½ï¿½ï¿½ï¿½ï¿½ï¿½ï¿½ï¿½ï¿½ï¿½ï¿½ï¿½ï¿½ï¿½ï¿½ï¿½ï¿½ wan to carr,,,
normal text,Beautiful truth : Expression of the face could Be seen by everyone... But the depression of heart Could be understood only By the Loved ones.. Gud Ni8;-),,,
normal text,Infact happy new year. How are you where are you when are we seeing,,,
it may be a spam message,"In The Simpsons Movie released in July 2007 name the band that died at the start of the film? A-Green Day, B-Blue Day, C-Red Day. (Send A, B or C)",,,
normal text,That's a snormal texte! Maybe cld meet for few hrs tomo?,,,
normal text,Lol I would but despite these cramps I like being a girl.,,,
normal text,I canï¿½ï¿½ï¿½ï¿½ï¿½ï¿½ï¿½ï¿½ï¿½ï¿½ï¿½ï¿½ï¿½ï¿½ï¿½ï¿½ï¿½ï¿½t wait for cornwall. Hope tonight isnï¿½ï¿½ï¿½ï¿½ï¿½ï¿½ï¿½ï¿½ï¿½ï¿½ï¿½ï¿½ï¿½ï¿½ï¿½ï¿½ï¿½ï¿½t too bad a,,,
normal text,Pls help me tell sura that i'm expecting a battery from hont. And that if should pls send me a message about how to download movies. Thanks,,,
it may be a spam message,Please call Amanda with regard to renewing or upgrading your current T-Mobile handset free of charge. Offer ends today. Tel 0845 021 3680 subject to T's and C's,,,
normal text,"Haven't found a way to get another app for your phone, eh ? Will you go to the net cafe ? Did you take that job? Geeee I need you babe. I crave to see you ...",,,
normal text,I only work from mon to thurs but Sat i cant leh... Booked liao... Which other day u free?,,,
normal text,ýý comin to fetch us oredi...,,,
normal text,What's nannys address?,,,
it may be a spam message,"URGENT!! Your 4* Costa Del Sol Holiday or ï¿½ï¿½ï¿½ï¿½ï¿½ï¿½ï¿½ï¿½ï¿½ï¿½ï¿½ï¿½ï¿½ï¿½ï¿½ï¿½ï¿½ï¿½5000 await collection. Call 09050090044 Now toClaim. SAE, TC s, P",,,
normal text,Haf u eaten? Wat time u wan me 2 come?,,,
it may be a spam message,Want a new Video Phone? 750 anytime any network mins? Half price line rental free text for 3 months? Reply or call 08000930705 for free delivery,,,
normal text,"Yo, call me when you get the chance, a friend of mine wanted me to ask you about a big order",,,
normal text,This single single answers are we fighting? Plus i said am broke and you didnt reply,,,
normal text,It certainly puts things into perspective when something like this happens,,,
normal text,Now got tv 2 watch meh? U no work today?,,,
normal text,i felt so...not any conveying reason.. Ese he... What about me?,,,
it may be a spam message,Had your mobile 11 months or more? U R entitled to Update to the latest colour mobiles with camera for Free! Call The Mobile Update Co FREE on 08002986030,,,
normal text,How's it going? Got any exciting karaoke type activities planned? I'm debating whether to play football this eve. Feeling lazy though.,,,
normal text,I told that am coming on wednesday.,,,
normal text,"Its ok, called mom instead have fun",,,
it may be a spam message,"Dear Voucher Holder, To claim this weeks offer, at your PC please go to http://www.wtlp.co.uk/text. Ts&Cs apply.",,,
normal text,Well if I'm that desperate I'll just call armand again,,,
normal text,Are you at work right now ?,,,
it may be a spam message,Congrats! Nokia 3650 video camera phone is your Call 09066382422 Calls cost 150ppm Ave call 3mins vary from mobiles 16+ Close 300603 post BCM4284 Ldn WC1N3XX,,,
normal text,Haven't heard anything and he's not answering my texts so I'm guessing he flaked. That said the jb is fantastic,,,
normal text,"Mmmmmm ... I love you,so much, Ahmad ... I can't wait for this year to begin as every second takes me closer to being at your side. Happy New Year, my love!!",,,
normal text,Pls what's the full name of joke's school cos fees in university of florida seem to actually be  &lt;#&gt; k. Pls holla back,,,
normal text,"Sorry, I'll call later",,,
normal text,Ok... But they said i've got wisdom teeth hidden inside n mayb need 2 remove.,,,
normal text,And pls pls drink plenty plenty water,,,
normal text,How are you doing. How's the queen. Are you going for the royal wedding,,,
normal text,He's in lag. That's just the sad part but we keep in touch thanks to skype,,,
normal text,Ok lor then we go tog lor...,,,
normal text,Two teams waiting for some players,,,
normal text,Can ï¿½ï¿½ï¿½ï¿½ï¿½ï¿½ï¿½ï¿½ï¿½_ se,,,
normal text,"swhrt how u dey,hope ur ok, tot about u 2day.love n miss.take care.",,,
normal text,"Ok da, i already planned. I wil pick you.",,,
it may be a spam message,"Urgent! Please call 0906346330. Your ABTA complimentary 4* Spanish Holiday or ï¿½ï¿½ï¿½ï¿½ï¿½ï¿½ï¿½ï¿½ï¿½ï¿½ï¿½ï¿½ï¿½ï¿½ï¿½ï¿½ï¿½ï¿½10,000 cash ",,,
normal text,"Sorry, I'll call later in meeting",,,
normal text,I just really need shit before tomorrow and I know you won't be awake before like 6,,,
normal text,I'm good. Have you registered to vote?,,,
normal text,"Hmm ok, i'll stay for like an hour cos my eye is really sore!",,,
normal text,Dear got bus directly to calicut,,,
normal text,Mm umma ask vava also to come tell him can play later together,,,
normal text,"Well the general price is  &lt;#&gt; /oz, let me know if/when/how much you want",,,
normal text,"Sorry, I'll call later",,,
normal text,"Each Moment in a day,has its own value-Morning brings hope,afternoon brings faith,Evening brings luv,Night brings rest,Wish u find them all today.Good Morning",,,
normal text,&lt;#&gt;  w jetton ave if you forgot,,,
normal text,Ok i'm coming home now.,,,
normal text,Can not use foreign stamps in this country.,,,
it may be a spam message,"Double mins and txts 4 6months FREE Bluetooth on Orange. Available on Sony, Nokia Motorola phones. Call MobileUpd8 on 08000839402 or call2optout/N9DX",,,
normal text,"Sorry, it's a lot of friend-of-a-friend stuff, I'm just now about to talk to the actual guy who wants to buy",,,
it may be a spam message,FREE for 1st week! No1 Nokia tone 4 ur mob every week just txt NOKIA to 8007 Get txting and tell ur mates www.getzed.co.uk POBox 36504 W45WQ norm150p/tone 16+,,,
it may be a spam message,"Want to funk up ur fone with a weekly new tone reply TONES2U 2 this text. www.ringtones.co.uk, the original n best. Tones 3GBP network operator rates apply",,,
it may be a spam message,"cmon babe, make me horny, *turn* me on! Txt me your fantasy now babe -) Im hot, sticky and need you now. All replies cost ï¿½ï¿½ï¿½ï¿½ï¿½ï¿½ï¿½ï¿½ï¿",,,
normal text,I will come tomorrow di,,,
normal text,Wylie update: my weed dealer carlos went to freedom and had a class with lunsford,,,
normal text,Are you happy baby ? Are you alright ? Did you take that job ? I hope your fine. I send you a kiss to make you smile from across the sea ... *kiss* *kiss*,,,
normal text,C movie is juz last minute decision mah. Juz watch 2 lar but i tot ï¿½ï¿½ï¿½ï¿½ï¿½ï¿½,,,
normal text,How are you enjoying this semester? Take care brother.,,,
it may be a spam message,IMPORTANT INFORMATION 4 ORANGE USER 0796XXXXXX. TODAY IS UR LUCKY DAY!2 FIND OUT WHY LOG ONTO http://www.urawinner.com THERE'S A FANTASTIC PRIZEAWAITING YOU!,,,
normal text,"Get the door, I'm here",,,
normal text,"Lets use it next week, princess :)",,,
normal text,Or i go home first lar ï¿½ï¿½ï¿½ï¿½ï¿½ï¿½ï¿½ï¿½ï¿½_ wait 4 me lor.. I,,,
normal text,I want kfc its Tuesday. Only buy 2 meals ONLY 2. No gravy. Only 2 Mark. 2!,,,
normal text,No da:)he is stupid da..always sending like this:)don believe any of those message.pandy is a mental:),,,
normal text,Oi when you gonna ring,,,
it may be a spam message,Missed call alert. These numbers called but left no message. 07008009200,,,
normal text,I attended but nothing is there.,,,
normal text,Ard 530 like dat lor. We juz meet in mrt station then ï¿½ï¿½ï¿½ï¿½ï¿½ï¿½ï¿½ï¿,,,
normal text,No dear i was sleeping :-P,,,
normal text,Er mw im filled tuth is aight,,,
normal text,Will be office around 4 pm. Now i am going hospital.,,,
normal text,Actually i'm waiting for 2 weeks when they start putting ad.,,,
normal text,Anything lor if they all go then i go lor...,,,
normal text,U free on sat rite? U wan 2 watch infernal affairs wif me n darren n mayb xy?,,,
normal text,"Plz note: if anyone calling from a mobile Co. &amp; asks u to type # &lt;#&gt;  or # &lt;#&gt; . Do not do so. Disconnect the call,coz it iz an attempt of 'terrorist' to make use of the sim card no. Itz confirmd by nokia n motorola n has been verified by CNN IBN.",,,
normal text,Yo you around? A friend of mine's lookin to pick up later tonight,,,
normal text,Stupid auto correct on my phone,,,
normal text,Double eviction this week - Spiral and Michael and good riddance to them!,,,
normal text,"\The world suffers a lot... Not because of the violence of bad people. But because of the silence of good people!\"""," Gud night....""",,
normal text,"Ok thats cool. Its , just off either raglan rd or edward rd. Behind the cricket ground. Gimme ring when ur closeby see you tuesday.",,,
normal text,Buy one egg for me da..please:),,,
normal text,Have you started in skye,,,
normal text,Have you bookedthe hut? And also your time off? How are you by the way?,,,
normal text,And several to you sir.,,,
normal text,U really pig leh sleep so much. My dad wake me up at 10 smth 2 eat lunch today.,,,
normal text,I'm at home. Please call,,,
normal text,My love ... I hope your not doing anything drastic. Don't you dare sell your pc or your phone ...,,,
normal text,Now only i reached home. . . I am very tired now. . I will come tomorro,,,
it may be a spam message,FREEMSG: Our records indicate you may be entitled to 3750 pounds for the Accident you had. To claim for free reply with YES to this msg. To opt out text STOP,,,
it may be a spam message,U can WIN ï¿½ï¿½ï¿½ï¿½ï¿½ï¿½ï¿½ï¿½ï¿½ï¿½ï¿½ï¿½ï¿½ï¿½ï¿½ï¿½ï¿½ï¿½100 of Music Gift Vouchers every week starting NOW Txt the word DRAW to 87066 TsCs www.Idew.com ,,,
normal text,Life style garments account no please.,,,
normal text,Lol wtf random. Btw is that your lunch break,,,
normal text,"Sez, hows u & de arab boy? Hope u r all good give my love 2 evry1 love ya eshxxxxxxxxxxx",,,
normal text,"The LAY MAN! Just to let you know you are missed and thought off. Do have a great day. And if you can send me bimbo and ugo's numbers, ill appreciate. Safe",,,
normal text,Detroit. The home of snow. Enjoy it.,,,
it may be a spam message,Show ur colours! Euro 2004 2-4-1 Offer! Get an England Flag & 3Lions tone on ur phone! Click on the following service message for info!,,,
normal text,Okie...,,,
normal text,"Aight, I'm chillin in a friend's room so text me when you're on the way",,,
normal text,Is toshiba portege m100 gd?,,,
