Type,Message,,,
normal text,"Friendship is not a game to play, It is not a word to say, It doesn\'t start on March and ends on May, It is tomorrow, yesterday, today and e",,,
normal text,"Nice. Wait...should you be texting right now? I'm not gonna pay your ticket, ya know!",,,
normal text,I'm watching lotr w my sis dis aft. So u wan 2 meet me 4 dinner at nite a not?,,,
normal text,Why you keeping me away like this,,,
normal text,I think its far more than that but find out. Check google maps for a place from your dorm.,,,
normal text,My trip was ok but quite tiring lor. Uni starts today but it's ok 4 me cos i'm not taking any modules but jus concentrating on my final yr project.,,,
normal text,Have you always been saying welp?,,,
normal text,"I'm a guy, browsin is compulsory",,,
normal text,Ok...,,,
normal text,Purity of friendship between two is not about smiling after reading the forwarded message..Its about smiling just by seeing the name. Gud evng musthu,,,
normal text,"Sorry, I'll call later",,,
normal text,"(I should add that I don't really care and if you can't I can at least get this dude to fuck off but hey, your money if you want it)",,,
normal text,"Hello lover! How goes that new job? Are you there now? Are you happy? Do you think of me? I wake, my slave and send you a teasing kiss from across the sea",,,
normal text,I told your number to gautnormal text..,,,
normal text,Tell them no need to investigate about me anywhere.,,,
normal text,Ok i juz receive..,,,
normal text,"Cant believe i said so many things to you this morning when all i really wanted to say was good morning, i love you! Have a beautiful morning. See you in the library later.",,,
it may be a spam message,"Your account has been credited with 500 FREE Text Messages. To activate, just txt the word: CREDIT to No: 80488 T&Cs www.80488.biz",,,
normal text,In the end she might still vomit but its okay. Not everything will come out.,,,
normal text,How are you with moneY...as in to you...money aint a thing....how are you sha!,,,
normal text,It has everything to do with the weather. Keep extra warm. Its a cold but nothing serious. Pls lots of vitamin c,,,
normal text,Hey gals.. Anyone of u going down to e driving centre tmr?,,,
normal text,I'm always on yahoo messenger now. Just send the message to me and i.ll get it you may have to send it in the mobile mode sha but i.ll get it. And will reply.,,,
normal text,I'm putting it on now. It should be ready for  &lt;TIME&gt; ,,,
normal text,"Time n Smile r the two crucial things in our life. Sometimes time makes us to forget smile, and sometimes someone's smile makes us to forget time gud noon",,,
it may be a spam message,"SMS. ac JSco: Energy is high, but u may not know where 2channel it. 2day ur leadership skills r strong. Psychic? Reply ANS w/question. End? Reply END JSCO",,,
normal text,Host-based IDPS for linux systems.,,,
it may be a spam message,"HOT LIVE FANTASIES call now 08707509020 Just 20p per min NTT Ltd, PO Box 1327 Croydon CR9 5WB 0870 is a national rate call",,,
normal text,Don no da:)whats you plan?,,,
normal text,Ill be there on  &lt;#&gt;  ok.,,,
normal text,Oh my God. I'm almost home,,,
normal text,Total video converter free download type this in google search:),,,
it may be a spam message,Thanks for the Vote. Now sing along with the stars with Karaoke on your mobile. For a FREE link just reply with SING now.,,,
normal text,"Wen ur lovable bcums angry wid u, dnt take it seriously.. Coz being angry is d most childish n true way of showing deep affection, care n luv!.. kettoda manda... Have nice day da.",,,
normal text,Sounds like something that someone testing me would sayy,,,
normal text,When u love someone Dont make them to love u as much as u do. But Love them so much that they dont want to be loved by anyone except you... Gud nit.,,,
normal text,"Pete,is this your phone still? Its Jenny from college and Leanne.what are you up to now?:)",,,
normal text,Oops sorry. Just to check that you don't mind picking me up tomo at half eight from station. Would that be ok?,,,
normal text,"Hey sweet, I was wondering when you had a moment if you might come to me ? I want to send a file to someone but it won't go over yahoo for them because their connection sucks, remember when you set up that page for me to go to and download the format disc ? Could you tell me how to do that ? Or do you know some other way to download big files ? Because they can download stuff directly from the internet. Any help would be great, my prey ... *teasing kiss*",,,
normal text,Hows the cnormal textp just leaving glasgow!,,,
normal text,K:)all the best:)congrats...,,,
normal text,I wonder if you'll get this text?,,,
normal text,I need to come home and give you some good lovin...,,,
it may be a spam message,Our brand new mobile music service is now live. The free music player will arrive shortly. Just install on your phone to browse content from the top artists.,,,
normal text,Shall i ask one thing if you dont mistake me.,,,
normal text,Check wid corect speling i.e. Sarcasm,,,
it may be a spam message,"URGENT! Your Mobile No was awarded a ï¿½ï¿½ï¿½ï¿½ï¿½ï¿½ï¿½ï¿½ï¿½ï¿½ï¿½ï¿½ï¿½ï¿½ï¿½ï¿½ï¿½ï¿½2,000 Bonus Caller Prize on 1/08/03! This is our 2nd attempt to cont",,,
normal text,Are you angry with me. What happen dear,,,
normal text,I thk u dun haf 2 hint in e forum already lor... Cos i told ron n darren is going 2 tell shuhui.,,,
normal text,Yup ok thanx...,,,
normal text,Hi:)cts employee how are you?,,,
normal text,Pls pls find out from aunt nike.,,,
normal text,"Wow ... I love you sooo much, you know ? I can barely stand it ! I wonder how your day goes and if you are well, my love ... I think of you and miss you",,,
normal text,No screaming means shouting..,,,
normal text,Hey what happen de. Are you alright.,,,
normal text,Should I have picked up a receipt or something earlier,,,
normal text,I think chennai well settled?,,,
normal text,Oh dang! I didn't mean o send that to you! Lol!,,,
normal text,Unfortunately i've just found out that we have to pick my sister up from the airport that evening so don't think i'll be going out at all. We should try to go out one of th,,,
normal text,Horrible bf... I now v hungry...,,,
normal text,Remember on that day..,,,
it may be a spam message,You have won a Nokia 7250i. This is what you get when you win our FREE auction. To take part send Nokia to 86021 now. HG/Suite342/2Lands Row/W1JHL 16+,,,
normal text,How's it feel? Mr. Your not my real Valentine just my yo Valentine even tho u hardly play!!,,,
normal text,All sounds good. Fingers . Makes it difficult to type,,,
normal text,Midnight at the earliest,,,
normal text,You're not sure that I'm not trying to make xavier smoke because I don't want to smoke after being told I smoke too much?,,,
normal text,K come to nordstrom when you're done,,,
normal text,Do u konw waht is rael FRIENDSHIP Im gving yuo an exmpel: Jsut ese tihs msg.. Evrey splleing of tihs msg is wrnog.. Bt sitll yuo can raed it wihtuot ayn mitsake.. GOODNIGHT &amp; HAVE A NICE SLEEP..SWEET DREAMS..,,,
normal text,Now press conference da:),,,
it may be a spam message,"Hello from Orange. For 1 month's free access to games, news and sport, plus 10 free texts and 20 photo messages, reply YES. Terms apply: www.orange.co.uk/ow",,,
normal text,After completed degree. There is no use in joining finance.,,,
normal text,"Good afternoon, my love ! Any job prospects ? Are you missing me ? What do you do ? Are you being lazy and bleak, hmmm ? Or happy and filled with my love ?",,,
normal text,Shant disturb u anymore... Jia you...,,,
normal text,Bishan lar nearer... No need buy so early cos if buy now i gotta park my car...,,,
normal text,"Me, i dont know again oh",,,
normal text,Dude sux for snake. He got old and raiden got buff,,,
normal text,He says hi and to get your ass back to south tampa (preferably at a kegger),,,
normal text,In e msg jus now. U said thanks for gift.,,,
normal text,U too...,,,
normal text,Ok how you dear. Did you call chechi,,,
normal text,Yeah we do totes. When u wanna?,,,
normal text,Ok i found dis pierre cardin one which looks normal costs 20 its on sale.,,,
normal text,Good sleep is about rhythm. The person has to establish a rhythm that the body will learn and use. If you want to know more :-),,,
normal text,Wat r u doing?,,,
normal text,Message from . I am at Truro Hospital on ext. You can phone me here. as I have a phone by my side,,,
normal text,"Single line with a big meaning::::: \Miss anything 4 ur \""Best Life\"" but"," don't miss ur best life for anything... Gud nyt...""",,
normal text,"Just got some gas money, any chance you and the gang want to go on a grand nature adventure?",,,
normal text,Dnt worry...use ice pieces in a cloth pack.also take 2 tablets.,,,
normal text,Dude just saw a parked car with its sunroof popped up. Sux,,,
normal text,Get ready to put on your excellent sub face :),,,
normal text,Tmrw. Im finishing 9 doors,,,
normal text,"The  &lt;#&gt; g that i saw a few days ago, the guy wants sell wifi only for  &lt;#&gt;  and with 3g for  &lt;#&gt; . That's why i blanked him.",,,
normal text,I am late. I will be there at,,,
normal text,"whatever, im pretty pissed off.",,,
normal text,Today is ACCEPT DAY..U Accept me as? Brother Sister Lover Dear1 Best1 Clos1 Lvblefrnd Jstfrnd Cutefrnd Lifpartnr Belovd Swtheart Bstfrnd No rply means enemy,,,
normal text,I dont have that much image in class.,,,
normal text,No:-)i got rumour that you going to buy apartment in chennai:-),,,
normal text,Near kalainar tv office.thenampet,,,
it may be a spam message,Ur cash-balance is currently 500 pounds - to maximize ur cash-in now send GO to 86688 only 150p/msg. CC 08718720201 HG/Suite342/2Lands Row/W1J6HL,,,
it may be a spam message,SMS AUCTION - A BRAND NEW Nokia 7250 is up 4 auction today! Auction is FREE 2 join & take part! Txt NOKIA to 86021 now! HG/Suite342/2Lands Row/W1J6HL,,,
normal text,My sis is catching e show in e afternoon so i'm not watching w her. So c u wan 2 watch today or tmr lor.,,,
normal text,"Sounds gd... Haha... Can... Wah, u yan jiu so fast liao...",,,
normal text,No. To be nosy I guess. Idk am I over reacting if I'm freaked?,,,
normal text,"Remember all those whom i hurt during days of satanic imposter in me.need to pay a price,so be it.may destiny keep me going and as u said pray that i get the mind to get over the same.",,,
normal text,How to Make a girl Happy? It's not at all difficult to make girls happy. U only need to be... 1. A friend 2. Companion 3. Lover 4. Chef . . .  &lt;#&gt; . Good listener  &lt;#&gt; . Organizer  &lt;#&gt; . Good boyfriend  &lt;#&gt; . Very clean  &lt;#&gt; . Sympathetic  &lt;#&gt; . Athletic  &lt;#&gt; . Warm . . .  &lt;#&gt; . Courageous  &lt;#&gt; . Determined  &lt;#&gt; . True  &lt;#&gt; . Dependable  &lt;#&gt; . Intelligent . . .  &lt;#&gt; . Psychologist  &lt;#&gt; . Pest exterminator  &lt;#&gt; . Psychiatrist  &lt;#&gt; . Healer . .  &lt;#&gt; . Stylist  &lt;#&gt; . Driver . . Aaniye pudunga venaam..,,,
normal text,"Why is that, princess? I bet the brothas are all chasing you!",,,
normal text,"I shall book chez jules for half eight, if that's ok with you?",,,
normal text,Hhahhaahahah rofl wtf nig was leonardo in your room or something,,,
normal text,"Yep, at derek's house now, see you Sunday &lt;3",,,
normal text,"It's cool, let me know before it kicks off around  &lt;#&gt; , I'll be out and about all day",,,
normal text,"Sorry, I'll call later",,,
normal text,I was wondering if it would be okay for you to call uncle john and let him know that things are not the same in nigeria as they r here. That  &lt;#&gt;  dollars is 2years sent and that you know its a strain but i plan to pay back every dime he gives. Every dime so for me to expect anything from you is not practical. Something like that.,,,
normal text,There are no other charges after transfer charges and you can withdraw anyhow you like,,,
normal text,"Dont search love, let love find U. Thats why its called falling in love, bcoz U dont force yourself, U just fall and U know there is smeone to hold U... BSLVYL",,,
normal text,At 4. Let's go to bill millers,,,
normal text,I love you. You set my soul on fire. It is not just a spark. But it is a flame. A big rawring flame. XoXo,,,
normal text,"Somewhr someone is surely made 4 u. And God has decided a perfect time to make u meet dat person. . . . till den, . . . . . Enjoy ur crushes..!!!;-)",,,
normal text,That's my honeymoon outfit. :),,,
normal text,Will it help if we propose going back again tomorrow,,,
it may be a spam message,PRIVATE! Your 2003 Account Statement for shows 800 un-redeemed S. I. M. points. Call 08719899230 Identifier Code: 41685 Expires 07/11/04,,,
normal text,Never blame a day in ur life. Good days give u happiness. Bad days give u experience. Both are essential in life! All are Gods blessings! good morning.:,,,
normal text,Pls confirm the time to collect the cheque.,,,
it may be a spam message,As a Registered Subscriber yr draw 4 a ï¿½ï¿½ï¿½ï¿½ï¿½ï¿½ï¿½ï¿½ï¿½ï¿½ï¿½ï¿½ï¿½ï¿½ï¿½ï¿½ï¿½ï¿½100 gift voucher will b entered on receipt of a corre,,,
it may be a spam message,URGENT! Your Mobile number has been awarded with a ï¿½ï¿½ï¿½ï¿½ï¿½ï¿½ï¿½ï¿½ï¿½ï¿½ï¿½ï¿½ï¿½ï¿½ï¿½ï¿½ï¿½ï¿½2000 prize GUARANTEED. Call 09061790121,,,
normal text,Daddy will take good care of you :),,,
normal text,"Yeah probably, I still gotta check out with leo",,,
normal text,K.then any other special?,,,
normal text,Carlos is taking his sweet time as usual so let me know when you and patty are done/want to smoke and I'll tell him to haul ass,,,
normal text,Ok pa. Nothing problem:-),,,
normal text,Have you heard about that job? I'm going to that wildlife talk again tonight if u want2come. Its that2worzels and a wizzle or whatever it is?! ,,,
normal text,"God picked up a flower and dippeditinaDEW, lovingly touched itwhichturnedinto u, and the he gifted tomeandsaid,THIS FRIEND IS 4U",,,
normal text,When you came to hostel.,,,
normal text,Ok no prob... I'll come after lunch then...,,,
normal text,Jus telling u dat i'll b leaving 4 shanghai on 21st instead so we'll haf more time 2 meet up cya...,,,
normal text,Are your freezing ? Are you home yet ? Will you remember to kiss your mom in the morning? Do you love me ? Do you think of me ? Are you missing me yet ?,,,
normal text,You all ready for * big day tomorrow?,,,
normal text,I'll probably be around mu a lot,,,
normal text,645,,,
it may be a spam message,RT-KIng Pro Video Club>> Need help? info@ringtoneking.co.uk or call 08701237397 You must be 16+ Club credits redeemable at www.ringtoneking.co.uk! Enjoy!,,,
normal text,Thnx dude. u guys out 2nite?,,,
normal text,Me sef dey laugh you. Meanwhile how's my darling anjie!,,,
normal text,Mm i had my food da from out,,,
normal text,"K, makes sense, btw carlos is being difficult so you guys are gonna smoke while I go pick up the second batch and get gas",,,
normal text,Did u download the fring app?,,,
normal text,The 2 oz guy is being kinda flaky but one friend is interested in picking up $ &lt;#&gt;  worth tonight if possible,,,
normal text,Friends that u can stay on fb chat with,,,
normal text,"Fuck babe, I miss you sooooo much !! I wish you were here to sleep with me ... My bed is so lonely ... I go now, to sleep ... To dream of you, my love ...",,,
normal text,"Living is very simple.. Loving is also simple.. Laughing is too simple.. Winning is tooo simple.. But, being 'SIMPLE' is very difficult.. Gud nte.:-",,,
it may be a spam message,U have a secret admirer who is looking 2 make contact with U-find out who they R*reveal who thinks UR so special-call on 09058094599,,,
normal text,"Ah, well that confuses things, doesnï¿½ï¿½ï¿",,,
it may be a spam message,500 free text msgs. Just text ok to 80488 and we'll credit your account,,,
normal text,Hi Dear Call me its urgnt. I don't know whats your problem. You don't want to work or if you have any other problem at least tell me. Wating for your reply.,,,
normal text,Dear how you. Are you ok?,,,
it may be a spam message,You have been selected to stay in 1 of 250 top British hotels - FOR NOTHING! Holiday Worth ï¿½ï¿½ï¿½ï¿½ï¿½ï¿½ï¿½ï¿½ï¿½ï¿½ï¿½ï¿½ï¿½ï¿½ï¿½ï¿½ï¿½ï¿½35,,,
normal text,Yes princess! I want to make you happy...,,,
normal text,Sounds like you have many talents! would you like to go on a dinner date next week?,,,
normal text,I am going to film 2day da. At 6pm. Sorry da.,,,
normal text,We not watching movie already. Xy wants 2 shop so i'm shopping w her now.,,,
normal text,Hello my little party animal! I just thought I'd buzz you as you were with your friends ...*grins*... Reminding you were loved and send a naughty adoring kiss,,,
normal text,Yesterday its with me only . Now am going home.,,,
it may be a spam message,"Eerie Nokia tones 4u, rply TONE TITLE to 8007 eg TONE DRACULA to 8007 Titles: GHOST, ADDAMSFA, MUNSTERS, EXORCIST, TWILIGHT www.getzed.co.uk POBox36504W45WQ 150p",,,
normal text,"You have come into my life and brought the sun ..Shiny down on me, warming my heart. Putting a constant smile on my face ... Making me feel loved and cared for",,,
normal text,"No shit, but I wasn't that surprised, so I went and spent the evening with that french guy I met in town here and we fooled around a bit but I didn't let him fuck me",,,
it may be a spam message,"0A$NETWORKS allow companies to bill for SMS, so they are responsible for their \suppliers\"""," just as a shop has to give a guarantee on what they sell. B. G.""",,
normal text,Great comedy..cant stop laughing da:),,,
it may be a spam message,FreeMsg:Feelin kinda lnly hope u like 2 keep me company! Jst got a cam moby wanna c my pic?Txt or reply DATE to 82242 Msg150p 2rcv Hlp 08712317606 stop to 82242,,,
normal text,"Alright, we're all set here, text the man",,,
normal text,"Hi , where are you? We're at  and they're not keen to go out i kind of am but feel i shouldn't so can we go out tomo, don't mind do you?",,,
normal text,Sleeping nt feeling well,,,
normal text,U WILL SWITCH YOUR FONE ON DAMMIT!!,,,
normal text,India have to take lead:),,,
normal text,I.ll post her out l8r. In class,,,
normal text,Thts wat Wright Brother did to fly..,,,
normal text,"Evening * v good if somewhat event laden. Will fill you in, don't you worry ï¿½ï¿½ï¿½ï¿½ï¿½ï¿½ï¿½ï¿½ï¿½ï¿½ï¿½ï¿½ï¿½ï¿½ï¿½ï¿½ï¿½ï¿½_ ",,,
normal text,If u laugh really loud.. If u talk spontaneously.. If u dont care what others feel.. U are probably with your dear &amp; best friends.. GOODEVENING Dear..:),,,
normal text,ITS A LAPTOP TAKE IT WITH YOU.,,,
normal text,I dont have any of your file in my bag..i was in work when you called me.i 'll tell you if i find anything in my room.,,,
normal text,I wan but too early lei... Me outside now wun b home so early... Neva mind then...,,,
it may be a spam message,For ur chance to win a ï¿½ï¿½ï¿½ï¿½ï¿½ï¿½ï¿½ï¿½ï¿½ï¿½ï¿½ï¿½ï¿½ï¿½ï¿½ï¿½ï¿½ï¿½250 cash every wk TXT: ACTION to 80608. T's&C',,,
normal text,I was at bugis juz now wat... But now i'm walking home oredi... ï¿½ï¿½ï¿½ï¿½ï¿½ï¿½ï¿½ï¿½ï¿½ï¿½ï¿½ï¿½ï¿½ï¿½ï¿½ï¿½ï¿½ï¿½ so late then reply... I oso ,,,
normal text,"Wishing you and your family Merry \X\"" mas and HAPPY NEW Year in advance..""",,,
normal text,At 7 we will go ok na.,,,
normal text,Yes I posted a couple of pics on fb. There's still snow outside too. I'm just waking up :),,,
normal text,S:-)if we have one good partnership going we will take lead:),,,
it may be a spam message,RGENT! This is the 2nd attempt to contact U!U have WON ï¿½ï¿½ï¿½ï¿½ï¿½ï¿½ï¿½ï¿½ï¿½ï¿½ï¿½ï¿½ï¿½ï¿½ï¿½ï¿½ï¿½ï¿½1250 CALL 09071512433 b4 050703 T&CsBCM,,,
normal text,"Yeah, where's your class at?",,,
normal text,No just send to you. Bec you in temple na.,,,
normal text,"You aren't coming home between class, right? I need to work out and shower!",,,
it may be a spam message,Hi if ur lookin 4 saucy daytime fun wiv busty married woman Am free all next week Chat now 2 sort time 09099726429 JANINExx Callsï¿½ï¿½ï¿½ï¿½ï¿½ï¿½ï¿½ï¿½ï¿½ï¿½ï,,,
normal text,S but mostly not like that.,,,
normal text,ýý v ma fan...,,,
normal text,Dunno cos i was v late n when i reach they inside already... But we ate spageddies lor... It's e gals who r laughing at me lor...,,,
normal text,Guess who spent all last night phasing in and out of the fourth dimension,,,
normal text,So now my dad is gonna call after he gets out of work and ask all these crazy questions.,,,
normal text,"Yes..but they said its IT.,",,,
normal text,Very hurting n meaningful lines ever: \I compromised everything for my love," But at d end my love compromised me for everything:-(\"".. Gud mornin:-)""",,
normal text,Lmao!nice 1,,,
normal text,Glad to see your reply.,,,
it may be a spam message,URGENT! We are trying to contact U. Todays draw shows that you have won a ï¿½ï¿½ï¿½ï¿½ï¿½ï¿½ï¿½ï¿½ï¿½ï¿½ï¿½ï¿½ï¿½ï¿½ï¿½ï¿½ï¿½ï¿½800 prize GUARANTEED. Call 090,,,
it may be a spam message,Monthly password for wap. mobsi.com is 391784. Use your wap phone not PC.,,,
normal text,Nah dub but je still buff,,,
normal text,Painful words- \I thought being Happy was the most toughest thing on Earth... But," the toughest is acting Happy with all unspoken pain inside..\""""",,
normal text,"Yeah, that's fine! It's ï¿½ï¿½ï¿½ï¿½ï¿½ï¿½ï¿½ï¿½ï¿½",,,
normal text,Lol where do u come up with these ideas?,,,
normal text,"So many people seems to be special at first sight, But only very few will remain special to you till your last sight.. Maintain them till life ends.. Sh!jas",,,
normal text,"Today is \song dedicated day..\"" Which song will u dedicate for me? Send this to all ur valuable frnds but first rply me...""",,,
normal text,Okay... We wait ah,,,
normal text,Y lei?,,,
normal text,HI BABE U R MOST LIKELY TO BE IN BED BUT IM SO SORRY ABOUT TONIGHT! I REALLY WANNA SEE U TOMORROW SO CALL ME AT 9. LOVE ME XXX,,,
normal text,Already am squatting is the new way of walking,,,
normal text,Do you want bold 2 or bb torch,,,
normal text,Cramps stopped. Going back to sleep,,,
it may be a spam message,todays vodafone numbers ending with 0089(my last four digits) are selected to received a ï¿½ï¿½ï¿½ï¿½ï¿½ï¿½ï¿½ï¿½ï¿½ï¿½ï¿½ï¿½ï¿½ï¿½ï¿½ï¿½ï¿½ï¿½350 award. If your number match,,,
it may be a spam message,Free Top ringtone -sub to weekly ringtone-get 1st week free-send SUBPOLY to 81618-?3 per week-stop sms-08718727870,,,
normal text,Nan sonathaya soladha. Why boss?,,,
normal text,Bring tat cd don forget,,,
it may be a spam message,Sunshine Quiz Wkly Q! Win a top Sony DVD player if u know which country the Algarve is in? Txt ansr to 82277. ï¿½ï¿½ï¿½ï¿½ï¿½ï,,,
normal text,I don't know but I'm raping dudes at poker,,,
normal text,Weightloss! No more girl friends. Make loads of money on ebay or something. And give thanks to God.,,,
normal text,Was gr8 to see that message. So when r u leaving? Congrats dear. What school and wat r ur plans.,,,
normal text,ýý eatin later but i'm eatin wif my frens now lei... ýý going home first? ,,,
normal text,Finish already... Yar they keep saying i mushy... I so embarrassed ok...,,,
normal text,"Sorry man, my stash ran dry last night and I can't pick up more until sunday",,,
normal text,Hai priya are you right. What doctor said pa. Where are you.,,,
it may be a spam message,"Free msg. Sorry, a service you ordered from 81303 could not be delivered as you do not have sufficient credit. Please top up to receive the service.",,,
normal text,Ok...,,,
normal text,Please ask mummy to call father,,,
normal text,Can come my room but cannot come my house cos my house still messy... Haha...,,,
normal text,I have lost 10 kilos as of today!,,,
normal text,Just taste fish curry :-P,,,
normal text,What can i do? Might accidant tookplace between somewhere ghodbandar rd. Traffic moves slovely. So plz slip &amp; don't worry.,,,
normal text,Yun ah.now ï¿½ï¿½ï¿½ï¿½ï¿½ï¿½ï¿½ï¿½ï¿½_ wkg where?btw if ï¿½ï¿½ï¿½ï¿½ï¿,,,
normal text,Yes! I am a one woman man! Please tell me your likes and dislikes in bed...,,,
normal text,Was doing my test earlier. I appreciate you. Will call you tomorrow.,,,
normal text,"How's my loverboy doing ? What does he do that keeps him from coming to his Queen, hmmm ? Doesn't he ache to speak to me ? Miss me desparately ?",,,
normal text,U meet other fren dun wan meet me ah... Muz b a guy rite...,,,
normal text,"(No promises on when though, haven't even gotten dinner yet)",,,
normal text,I got your back! Do you have any dislikes in bed?,,,
normal text,o turns out i had stereo love on mi phone under the unknown album.,,,
it may be a spam message,Hard LIVE 121 chat just 60p/min. Choose your girl and connect LIVE. Call 09094646899 now! Cheap Chat UK's biggest live service. VU BCM1896WC1N3XX,,,
normal text,Yeah I don't see why not,,,
normal text,Asking do u knw them or nt? May be ur frnds or classmates?,,,
normal text,"Sorry about earlier. Putting out fires.Are you around to talk after 9? Or do you actually have a life, lol!",,,
it may be a spam message,WOW! The Boys R Back. TAKE THAT 2007 UK Tour. Win VIP Tickets & pre-book with VIP Club. Txt CLUB to 81303. Trackmarque Ltd info@vipclub4u.,,,
