Type,Message,,,
normal text,Cool. I am  &lt;#&gt;  inches long. hope you like them big!,,,
normal text,"House-Maid is the murderer, coz the man was murdered on  &lt;#&gt; th January.. As public holiday all govt.instituitions are closed,including post office..understand?",,,
normal text,Okie.. Thanx..,,,
it may be a spam message,18 days to Euro2004 kickoff! U will be kept informed of all the latest news and results daily. Unsubscribe send GET EURO STOP to 83222.,,,
normal text,Go where n buy? Juz buy when we get there lar.,,,
normal text,Ok lor...,,,
normal text,I'm working technical support :)voice process.,,,
normal text,It's justbeen overa week since we broke up and already our brains are going to mush!,,,
normal text,"Tunde, how are you doing. This is just wishing you a great day. Abiola.",,,
normal text,Nope... C ï¿½ï¿½ï¿½ï,,,
normal text,No. But we'll do medical missions to nigeria,,,
normal text,No i am not having not any movies in my laptop,,,
normal text,Whatsup there. Dont u want to sleep,,,
it may be a spam message,Urgent Please call 09066612661 from landline. ï¿½ï¿½ï¿½ï¿½ï¿½ï¿½ï¿½ï¿½ï¿½ï¿½ï¿½ï¿½ï¿½ï¿½ï¿½ï¿½ï¿½ï¿½5000 cash or a luxury 4* Canary Islands Holiday await ,,,
it may be a spam message,"Urgent! Please call 09066612661 from your landline, your complimentary 4* Lux Costa Del Sol holiday or ï¿½ï¿½ï¿½ï¿½ï¿½ï¿½ï¿½ï¿½ï¿½ï¿½ï¿½ï¿½ï¿½ï¿½ï¿½ï¿½ï¿½ï¿½1000 CASH",,,
normal text,I havent lei.. Next mon can?,,,
normal text,Mm feeling sleepy. today itself i shall get that dear,,,
normal text,How dare you stupid. I wont tell anything to you. Hear after i wont talk to you:-.,,,
normal text,Do ï¿½ï¿½ï¿½ï¿½ï¿½ï¿½ï¿½ï¿,,,
normal text,Can you do a mag meeting this avo at some point?,,,
normal text,I meant middle left or right?,,,
normal text,Really? I crashed out cuddled on my sofa.,,,
normal text,Hi Chachi tried calling u now unable to reach u .. Pl give me a missed cal once u c tiz msg  Kanagu,,,
normal text,"I sent you the prices and do you mean the  &lt;#&gt; g,",,,
normal text,Are you this much buzy,,,
normal text,Nothing. Can...,,,
it may be a spam message,I don't know u and u don't know me. Send CHAT to 86688 now and let's find each other! Only 150p/Msg rcvd. HG/Suite342/2Lands/Row/W1J6HL LDN. 18 years or over.,,,
normal text,No * am working on the ringing u thing but have whole houseful of screaming brats so * am pulling my hair out! Loving u,,,
normal text,But my family not responding for anything. Now am in room not went to home for diwali but no one called me and why not coming. It makes me feel like died.,,,
normal text,"Tick, tick, tick ... Babe",,,
normal text,R ï¿½ï¿½ï¿½ï¿½ï¿½ï¿½ï¿½ï¿½ï¿½,,,
normal text,K da:)how many page you want?,,,
normal text,Ya had just now.onion roast.,,,
normal text,Send his number and give reply tomorrow morning for why you said that to him like that ok,,,
normal text,You said not now. No problem. When you can. Let me know.,,,
normal text,Ok but tell me half an hr b4 u come i need 2 prepare.,,,
normal text,Play w computer? Aiyah i tok 2 u lor?,,,
normal text,Sat right? Okay thanks... ,,,
normal text,"Derp. Which is worse, a dude who always wants to party or a dude who files a complaint about the three drug abusers he lives with",,,
normal text,Ok Chinese food on its way. When I get fat you're paying for my lipo.,,,
normal text,We r outside already.,,,
normal text,Have a good trip. Watch out for . Remember when you get back we must decide about easter.,,,
normal text,Yo we are watching a movie on netflix,,,
normal text,What time. Iï¿½ï¿½ï¿½ï¿½ï¿½ï¿½ï¿½ï¿½ï¿½,,,
normal text,"Can meh? Thgt some will clash... Really ah, i dun mind... I dun seen to have lost any weight... Gee...",,,
normal text,I dont thnk its a wrong calling between us,,,
normal text,I am not sure about night menu. . . I know only about noon menu,,,
normal text,ARR birthday today:) i wish him to get more oscar.,,,
normal text,"Say this slowly.? GOD,I LOVE YOU &amp; I NEED YOU,CLEAN MY HEART WITH YOUR BLOOD.Send this to Ten special people &amp; u c miracle tomorrow, do it,pls,pls do it...",,,
normal text,"Open rebtel with firefox. When it loads just put plus sign in the user name place, and it will show you two numbers. The lower number is my number. Once you pick that number the pin will display okay!",,,
normal text, and  picking them up from various points,,,
it may be a spam message,Married local women looking for discreet action now! 5 real matches instantly to your phone. Text MATCH to 69969 Msg cost 150p 2 stop txt stop BCMSFWC1N3XX,,,
normal text,Wow v v impressed. Have funs shopping!,,,
normal text,I am on the way to ur home,,,
it may be a spam message,Burger King - Wanna play footy at a top stadium? Get 2 Burger King before 1st Sept and go Large or Super with Coca-Cola and walk out a winner,,,
normal text,No problem. Talk to you later,,,
normal text,Then ur sis how?,,,
normal text,Still in customer place,,,
it may be a spam message,How come it takes so little time for a child who is afraid of the dark to become a teenager who wants to stay out all night?,,,
normal text,"Dude u knw also telugu..thts gud..k, gud nyt..",,,
normal text,We confirm eating at esplanade?,,,
normal text,Send me your id and password,,,
normal text,Kind of. Took it to garage. Centre part of exhaust needs replacing. Part ordered n taking it to be fixed tomo morning.,,,
it may be a spam message,For ur chance to win a ï¿½ï¿½ï¿½ï¿½ï¿½ï¿½ï¿½ï¿½ï¿½ï¿½ï¿½ï¿½ï¿½ï¿½ï¿½ï¿½ï¿½ï¿½250 cash every wk TXT: ACTION to 80608. T's&C's,,,
normal text,Well I might not come then...,,,
normal text,Long after I quit. I get on only like 5 minutes a day as it is.,,,
normal text,Then its most likely called Mittelschmertz. Google it. If you dont have paracetamol dont worry it will go.,,,
normal text,Well at this right I'm gonna have to get up and check today's steam sales/pee so text me when you want me to come get you,,,
normal text,"Just arrived, see you in a couple days &lt;3",,,
normal text,"K, wat s tht incident?",,,
normal text,Yeah get the unlimited,,,
normal text,cThen i thk shd b enuff.. Still got conclusion n contents pg n references.. I'll b doing da contents pg n cover pg..,,,
normal text,"Forgot it takes me 3 years to shower, sorry. Where you at/your phone dead yet?",,,
normal text,ýý got wat to buy tell us then ý_ no need to come in again.,,,
normal text,When you are big..| God will bring success.,,,
it may be a spam message,Uï¿½ï¿½ï¿½ï¿½ï¿½ï¿½ï¿½ï¿½ï¿½ï¿½ï¿½ï¿½ï¿½ï¿½ï¿½ï¿½ï¿½ï¿½ï¿½ï¿½ï¿½ï¿½ï¿½ï¿½ï¿½ï¿½ï¿½ve Bin Awarded ï¿½ï¿½ï¿½ï¿½ï¿½ï¿½ï¿½ï¿½ï¿½ï¿½ï¿½ï,,,
normal text,"ýý_ we r stayin here an extra week, back next wed. How did we do in the rugby this weekend? Hi to and and , c u soon \""normal text""",Well there's still a bit left if you guys want to tonight,,
normal text,Not from this campus. Are you in the library?,,,
normal text,"The affidavit says  &lt;#&gt;  E Twiggs St, division g, courtroom  &lt;#&gt; , &lt;TIME&gt;  AM. I'll double check and text you again tomorrow",,,
normal text,How will I creep on you now? ;_;,,,
normal text,Tell your friends what you plan to do on Valentines day @ &lt;URL&gt;,,,
normal text,If I get there before you after your ten billion calls and texts so help me god,,,
normal text,Purity of friendship between two is not about smiling after reading the forwarded message..Its about smiling just by seeing the name. Gud evng musthu,,,
normal text,I've told him that i've returned it. That should i re order it.,,,
normal text,"House-Maid is the murderer, coz the man was murdered on  &lt;#&gt; th January.. As public holiday all govt.instituitions are closed,including post office..",,,
normal text,Depends on where u going lor.,,,
normal text,And smile for me right now as you go and the world will wonder what you are smiling about and think your crazy and keep away from you ... *grins*,,,
it may be a spam message,FreeMsg>FAV XMAS TONES!Reply REAL,,,
normal text,Lil fever:) now fine:),,,
normal text,I think it's all still in my car,,,
normal text,Can a not?,,,
it may be a spam message,December only! Had your mobile 11mths+? You are entitled to update to the latest colour camera mobile for Free! Call The Mobile Update Co FREE on 08002986906 ,,,
normal text,Yes princess! I want to catch you with my big strong hands...,,,
normal text,Oh yeah I forgot. U can only take 2 out shopping at once.,,,
normal text,Mm so you asked me not to call radio,,,
normal text,Thinkin about someone is all good. No drugs for that,,,
normal text,"Say this slowly.? GOD,I LOVE YOU &amp; I NEED YOU,CLEAN MY HEART WITH YOUR BLOOD.Send this to Ten special people &amp; u c miracle tomorrow, do it,pls,pls do it...",,,
normal text,"Enjoy the showers of possessiveness poured on u by ur loved ones, bcoz in this world of lies, it is a golden gift to be loved truly..",,,
normal text,"Alright if you're sure, let me know when you're leaving",,,
normal text,Some are lasting as much as 2 hours. You might get lucky.,,,
normal text,Genius what's up. How your brother. Pls send his number to my skype.,,,
it may be a spam message,"Gr8 Poly tones 4 ALL mobs direct 2u rply with POLY TITLE to 8007 eg POLY BREATHE1 Titles: CRAZYIN, SLEEPINGWITH, FINEST, YMCA :getzed.co.uk POBox365O4W45WQ 300p",,,
normal text,Thk some of em find wtc too far... Weiyi not goin... E rest i dunno yet... R ur goin 4 dinner den i might b able to join...,,,
normal text,Don't forget who owns you and who's private property you are ... And be my good boy always .. *passionate kiss*,,,
it may be a spam message,INTERFLORA - ï¿½ï¿½ï¿½ï¿½ï¿½ï¿½ï¿½ï¿½ï¿½ï¿½ï¿½ï¿½ï¿½ï¿½ï¿½ï¿½ï¿½ï¿½It's not too late to order Interflora flowers for christmas call 0800 ,,,
normal text,Oh god..taken the teeth?is it paining,,,
it may be a spam message,ROMCAPit may be a spam message Everyone around should be responding well to your presence since you are so warm and outgoing. You are bringing in a real breath of sunshine.,,,
normal text,Then u ask darren go n pick u lor... But i oso sian tmr haf 2 meet lect...,,,
normal text,No need to buy lunch for me.. I eat maggi mee..,,,
it may be a spam message,"Congratulations - Thanks to a good friend U have WON the ï¿½ï¿½ï¿½ï¿½ï¿½ï¿½ï¿½ï¿½ï¿½ï¿½ï¿½ï¿½ï¿½ï¿½ï¿½ï¿½ï¿½ï¿½2,000 Xmas prize. 2 claim is easy, just call 08",,,
normal text,Ok lor...,,,
normal text,"Oh right, ok. I'll make sure that i do loads of work during the day!  got a really nasty cough today and is dry n shot so that should really help it!",,,
normal text,Wife.how she knew the time of murder exactly,,,
it may be a spam message,Send a logo 2 ur lover - 2 names joined by a heart. Txt LOVE NAME1 NAME2 MOBNO eg LOVE ADAM EVE 07123456789 to 87077 Yahoo! POBox36504W45WQ TxtNO 4 no ads 150p.,,,
normal text,Howz that persons story,,,
normal text,Thanx 4 sending me home...,,,
normal text,Its normally hot mail. Com you see!,,,
it may be a spam message,"You've won tkts to the EURO2004 CUP FINAL or ï¿½ï¿½ï¿½ï¿½ï¿½ï¿½ï¿½ï¿½ï¿½ï¿½ï¿½ï¿½ï¿½ï¿½ï¿½ï¿½ï¿½ï¿½800 CASH, to",,,
normal text,U sick still can go shopping?,,,
normal text,"Ya they are well and fine., BBD(pooja) full pimples..even she become quite black..and ur rite here its too cold, wearing sweatter..",,,
normal text,Nice.nice.how is it working?,,,
normal text,1's reach home call me.,,,
normal text,Were trying to find a Chinese food place around here,,,
normal text,"Easy mate, * guess the quick drink was bit ambitious.",,,
normal text,BABE !!! I miiiiiiissssssssss you ! I need you !!! I crave you !!! :-( ... Geeee ... I'm so sad without you babe ... I love you ...,,,
normal text,Ok thanx...,,,
normal text,aathi..where are you dear..,,,
normal text,"Tunji, how's the queen? how are you doing. This is just wishing you a great day. Abiola.",,,
normal text,Today iZ Yellow rose day. If u love my frndship give me 1 misscall &amp; send this to ur frndZ &amp; See how many miss calls u get. If u get 6missed U marry ur Lover.,,,
normal text,Will be out of class in a few hours. Sorry,,,
normal text,Wat time u finish ur lect today?,,,
it may be a spam message,"Free-message: Jamster!Get the crazy frog sound now! For poly text MAD1, for real text MAD2 to 88888. 6 crazy sounds for just 3 GBP/week! 16+only! T&C's apply",,,
normal text,"Sad story of a Man - Last week was my b'day. My Wife did'nt wish me. My Parents forgot n so did my Kids . I went to work. Even my Colleagues did not wish. As I entered my cabin my PA said, '' Happy B'day Boss !!''. I felt special. She askd me 4 lunch. After lunch she invited me to her apartment. We went there. She said,'' do u mind if I go into the bedroom for a minute ? '' ''OK'', I sed in a sexy mood. She came out 5 minuts latr wid a cake...n My Wife, My Parents, My Kidz, My Friends n My Colleagues. All screaming.. SURPRISE !! and I was waiting on the sofa.. ... ..... ' NAKED...!",,,
it may be a spam message,"YOUR CHANCE TO BE ON A REALITY FANTASY SHOW call now = 08707509020 Just 20p per min NTT Ltd, PO Box 1327 Croydon CR9 5WB 0870 is a national = rate call",,,
normal text,She's fine. Good to hear from you. How are you my dear? Happy new year oh.,,,
normal text,Are you going to wipro interview today?,,,
normal text,how tall are you princess?,,,
normal text,I doubt you could handle 5 times per night in any case...,,,
normal text,Haha... Hope ï¿½ï¿½ï¿½ï¿½ï¿½ï¿½ï¿½ï¿½ï¿½_ can hear the,,,
normal text,Your gonna be the death if me. I'm gonna leave a note that says its all robs fault. Avenge me.,,,
normal text,"Japanese Proverb: If one Can do it, U too Can do it, If none Can do it,U must do it Indian version: If one Can do it, LET HIM DO it.. If none Can do it,LEAVE it!! And finally Kerala version: If one can do it, Stop him doing it.. If none can do it, Make a strike against it ...",,,
normal text,Today i'm not workin but not free oso... Gee... Thgt u workin at ur fren's shop ? ,,,
normal text,In life when you face choices Just toss a coin not becoz its settle the question But while the coin in the air U will know what your heart is hoping for. Gudni8,,,
normal text,"Do you know why god created gap between your fingers..? So that, One who is made for you comes &amp; fills those gaps by holding your hand with LOVE..!",,,
normal text,I want to be there so i can kiss you and feel you next to me,,,
normal text,I am not at all happy with what you saying or doing,,,
it may be a spam message,Adult 18 Content Your video will be with you shortly,,,
normal text,"Ok that would b lovely, if u r sure. Think about wot u want to do, drinkin, dancin, eatin, cinema, in, out, about... Up to u! Wot about ? ",,,
normal text,What I'm saying is if you haven't explicitly told nora I know someone I'm probably just not gonna bother,,,
normal text,He says hi and to get your ass back to south tampa (preferably at a kegger),,,
normal text,Smith waste da.i wanna gayle.,,,
normal text,"Mum, i've sent you many many messages since i got here. I just want to know that you are actually getting them. Do enjoy the rest of your day.",,,
normal text,"Aight, tomorrow around  &lt;#&gt;  it is",,,
normal text,"House-Maid is the murderer, coz the man was murdered on  &lt;#&gt; th January.. As public holiday all govt.instituitions are closed,including post office..understand?",,,
it may be a spam message,"YOUR CHANCE TO BE ON A REALITY FANTASY SHOW call now = 08707509020 Just 20p per min NTT Ltd, PO Box 1327 Croydon CR9 5WB 0870 is a national = rate call.",,,
normal text,I actually did for the first time in a while. I went to bed not too long after i spoke with you. Woke up at 7. How was your night?,,,
normal text,See you there! ,,,
normal text,I dont understand your message.,,,
normal text,Crucify is c not s. You should have told me earlier.,,,
normal text,"Idk. You keep saying that you're not, but since he moved, we keep butting heads over freedom vs. responsibility. And i'm tired. I have so much other shit to deal with that i'm barely keeping myself together once this gets added to it.",,,
normal text,Fuck cedar key and fuck her (come over anyway tho),,,
normal text,twenty past five he said will this train have been to durnormal text already or not coz i am in a reserved seat,,,
it may be a spam message,"Hey Boys. Want hot XXX pics sent direct 2 ur phone? Txt PORN to 69855, 24Hrs free and then just 50p per day. To stop text STOPBCM SF WC1N3XX",,,
normal text,U still painting ur wall?,,,
it may be a spam message,"Last Chance! Claim ur ï¿½ï¿½ï¿½ï¿½ï¿½ï¿½ï¿½ï¿½ï¿½ï¿½ï¿½ï¿½ï¿½ï¿½ï¿½ï¿½ï¿½ï¿½150 worth of discount vouchers today! Text SHOP to 85023 now! SavaMob, offers ",,,
normal text,Printer is cool. I mean groovy. Wine is groovying,,,
normal text,Hi Harish's rent has been transfred to ur Acnt.,,,
normal text,Anything lor is she coming?,,,
normal text,Cbe is really good nowadays:)lot of shop and showrooms:)city is shaping good.,,,
normal text,ýý still attending da talks?,,,
normal text,No probs hon! How u doinat the mo?,,,
normal text,K I'll take care of it,,,
normal text,I take it we didn't have the phone callon Friday. Can we assume we won't have it this year now?,,,
normal text,My battery is low babe,,,
normal text,Shuhui has bought ron's present it's a swatch watch...,,,
normal text,"Yeah there's quite a bit left, I'll swing by tomorrow when I get up",,,
normal text,Babe? You said 2 hours and it's been almost 4 ... Is your internet down ?,,,
normal text,K I'll be sure to get up before noon and see what's what,,,
normal text,K...k...yesterday i was in cbe .,,,
normal text,Went to ganesh dress shop,,,
it may be a spam message,"pdate_Now - Double mins and 1000 txts on Orange tariffs. Latest Motorola, SonyEricsson & Nokia & Bluetooth FREE! Call MobileUpd8 on 08000839402 or call2optout/!YHL",,,
normal text,ýý collecting ur laptop then going to configure da settings izzit?,,,
normal text,If you r @ home then come down within 5 min,,,
normal text,"Aight, I should be there by 8 at the latest, probably closer to 7. Are jay and tyler down or should we just do two trips?",,,
normal text,Come aftr  &lt;DECIMAL&gt; ..now i m cleaning the house,,,
it may be a spam message,Ur cash-balance is currently 500 pounds - to maximize ur cash-in now send CASH to 86688 only 150p/msg. CC: 08718720201 PO BOX 114/14 TCR/W1,,,
normal text,"Bill, as in: Are there any letters for me. iï¿½ï¿½ï¿½ï¿½ï¿½ï¿½ï¿½ï¿½ï¿½ï¿½ï¿½ï¿½ï¿½ï¿½ï¿½ï¿½ï¿½ï¿½ï¿½ï¿½ï¿½ï¿½ï¿½ï¿½ï¿½ï¿½ï¿½m",,,
normal text,Tell me pa. How is pain de.,,,
normal text,HI DARLIN I HOPE YOU HAD A NICE NIGHT I WISH I HAD COME CANT WAIT TO SEE YOU LOVE FRAN PS I WANT DIRTY ANAL SEX AND I WANT A 10 MAN GANG BANG,,,
normal text,Ha. You donï¿½ï¿½ï¿½ï¿½ï¿½ï¿½ï¿½ï¿½ï¿½ï¿½ï¿½ï¿½ï¿½ï¿½ï¿½ï¿½ï¿½ï¿½ï¿½ï¿½ï¿½ï¿½ï¿½ï¿½ï¿½ï¿½ï¿½t know either. I di,,,
normal text,"Helloooo... Wake up..! \Sweet\"" \""morning\"" \""welcomes\"" \""You\"" \""Enjoy\"" \""This Day\"" \""with full of joy\"".. \""GUD MRNG\"".""",,,
normal text,ALRITE,,,
normal text,Why must we sit around and wait for summer days to celebrate. Such a magical sight when the worlds dressed in white. Oooooh let there be snow.,,,
it may be a spam message,URGENT! Your Mobile number has been awarded with a ï¿½ï¿½ï¿½ï¿½ï¿½ï¿½ï¿½ï¿½ï¿½ï¿½ï¿½ï¿½ï¿½ï¿½ï¿½ï¿½ï¿½ï¿½2000 prize GUARANTEED. Call 0905,,,
normal text,How do you guys go to see movies on your side.,,,
normal text,"Sorry,in meeting I'll call later",,,
normal text,You didn't have to tell me that...now i'm thinking. Plus he's going to stop all your runs,,,
normal text,Kindly send some one to our flat before  &lt;DECIMAL&gt;  today.,,,
it may be a spam message,Sorry! U can not unsubscribe yet. THE MOB offer package has a min term of 54 weeks> pls resubmit request after expiry. Reply THEMOB HELP 4 more info,,,
normal text,Nothing lor... A bit bored too... Then y dun u go home early 2 sleep today...,,,
normal text,What time should I tell my friend to be around?,,,
normal text,Yes. that will be fine. Love you. Be safe.,,,
normal text,Thanks chikku..:-) gud nyt:-*,,,
normal text,Is xy in ur car when u picking me up?,,,
normal text,Thanx 4 the time weï¿½ï¿½ï¿½ï¿½ï¿½ï¿½ï¿½ï¿½ï¿½ï¿½ï¿½ï¿½ï¿½ï¿½ï¿½ï¿½ï¿½ï¿½ve spent 2gev,,,
normal text,"Yo, any way we could pick something up tonight?",,,
normal text,I've not sent it. He can send me.,,,
normal text,Fine am simply sitting.,,,
normal text,Thts god's gift for birds as humans hav some natural gift frm god..,,,
normal text,Are you coming to day for class.,,,
normal text,Im done. Just studyn in library,,,
normal text,Ok... U enjoy ur shows...,,,
normal text,Anything...,,,
normal text,Where wuld I be without my baby? The thought alone mite break me and I donï¿½ï¿½ï¿½ï¿½ï¿½ï¿½ï¿½ï¿½ï¿½ï¿½ï¿½ï¿½ï¿½ï¿½ï¿½ï¿½ï¿½ï¿½t,,,
normal text,Wat's my dear doing? Sleeping ah?,,,
normal text,Hi' Test on  &lt;#&gt; rd ....,,,
normal text,Only 2% students solved this CAT question in 'xam... 5+3+2= &lt;#&gt;  9+2+4= &lt;#&gt;  8+6+3= &lt;#&gt;  then 7+2+5=????? Tell me the answer if u r brilliant...1thing.i got d answr.,,,
normal text,Yo do you know anyone  &lt;#&gt;  or otherwise able to buy liquor? Our guy flaked and right now if we don't get a hold of somebody its just 4 loko all night,,,
normal text,Yup n her fren lor. I'm meeting my fren at 730.,,,
normal text,"Yeah, we got one lined up for us",,,
normal text,"And stop wondering \wow is she ever going to stop tm'ing me ?!\"" because I will tm you whenever I want because you are MINE ... *laughs*""",,,
normal text,Lol yep did that yesterday. Already got my fireplace. Now its just another icon sitting there for me.,,,
normal text,Hey i've booked the pilates and yoga lesson already... Haha,,,
normal text,Are you ok. What happen to behave like this,,,
it may be a spam message,You have 1 new message. Please call 08712400200.,,,
normal text,My supervisor find 4 me one lor i thk his students. I havent ask her yet. Tell u aft i ask her.,,,
normal text,"Hello. No news on job, they are making me wait a fifth week! Yeah im up for some woozles and weasels... In exeter still, but be home about 3. ",,,
normal text,No message..no responce..what happend?,,,
it may be a spam message,We currently have a message awaiting your collection. To collect your message just call 08718723815.,,,
normal text,"Hey babe, sorry i didn't get sooner. Gary can come and fix it cause he thinks he knows what it is but he doesn't go as far a Ptbo and he says it will cost  &lt;#&gt;  bucks. I don't know if it might be cheaper to find someone there ? We don't have any second hand machines at all right now, let me know what you want to do babe",,,
normal text,make that 3! 4 fucks sake?! x,,,
normal text,Leave it. U will always be ignorant.,,,
normal text,Nope but i'll b going 2 sch on fri quite early lor cos mys sis got paper in da morn :-),,,
normal text,at bruce b downs &amp; fletcher now,,,
normal text,Where are you ? You said you would be here when I woke ... :-(,,,
normal text,Hey now am free you can call me.,,,
normal text,Tell me whos this pls:-),,,
it may be a spam message,"URGENT! Your mobile was awarded a ï¿½ï¿½ï¿½ï¿½ï¿½ï¿½ï¿½ï¿½ï¿½ï¿½ï¿½ï¿½ï¿½ï¿½ï¿½ï¿½ï¿½ï¿½1,500 Bonus Caller Prize on 27/6",,,
normal text,"Think i might have to give it a miss. Am teaching til twelve, then have lecture at two. Damn this working thing.",,,
normal text,Id have to check but there's only like 1 bowls worth left,,,
normal text,Yes there were many sweets,,,
normal text,I would but I'm still cozy. And exhausted from last night.nobody went to school or work. Everything is closed.,,,
it may be a spam message,U have a secret admirer. REVEAL who thinks U R So special. Call 09065174042. To opt out Reply REVEAL STOP. 1.50 per msg recd. Cust care 07821230901,,,
normal text,Buzzzz! *grins* Did I buzz your ass? Buzz your chest ? Buzz your cock ? Where do you keep your phone ? Is the vibrator on ? Did you feel it shake ?,,,
normal text,Sir send to group mail check it.,,,
normal text,I'm doing da intro covers energy trends n pros n cons... Brief description of nuclear fusion n oso brief history of iter n jet got abt 7 n half pages..,,,
normal text,"\NONE!NOWHERE IKNO DOESDISCOUNT!SHITINNIT\""""",,,
normal text,You dont know you jabo me abi.,,,
it may be a spam message,"Do you ever notice that when you're driving, anyone going slower than you is an idiot and everyone driving faster than you is a maniac?",,,
normal text,Not yet had..ya sapna aunty manege y'day hogidhe..chinnu full weak and swalpa black agidhane..,,,
normal text,"Are you being good, baby? :)",,,
normal text,NEFT Transaction with reference number  &lt;#&gt;  for Rs. &lt;DECIMAL&gt;  has been credited to the beneficiary account on  &lt;#&gt;  at  &lt;TIME&gt; : &lt;#&gt;,,,
normal text,"Mostly sports type..lyk footbl,crckt..",,,
normal text,Ma head dey swell oh. Thanks for making my day,,,
normal text,U should make a fb list,,,
